eng;transcription;rus
vista;[ˈvɪstə];перспектива, вид, возможности, просека, аллея, вереница, виды на будущее
chips;[ˈtʃɪps];чипсы, кусочки, деньги, ломтики, бабки
flood;[flʌd];наводнение, поток, потоп, половодье, затоплять, заливать, наводнять
ease;[iːz];простота, легкость, облегчение, облегчать, ослаблять, потравить, травить
amsterdam;[ˈamstərˌdam];Амстердам, амстердамский
orgy;[ˈɔːrdʒɪ];оргия, разгул, множество, масса
arena;[əˈriːnə];арена, место действия, поле сражения
announcement;[əˈnaʊnsmənt];объявление, анонс, сообщение, уведомление, извещение
outcome;[ˈaʊtkʌm];результат, исход, выход, развязка, последствие
appreciate;[əˈpriːʃɪeɪt];ценить, оценивать, понимать, принимать во внимание, ощущать, повышать в ценности
expanded;[ɪkˈspandəd];расширенный, растянутый, разреженный
casual;[ˈkæʒʊəl];случайный, повседневный, небрежный, случайный посетитель
grown;[ɡrəʊn];взрослый
polish;[ˈpəʊlɪʃ];полировать, шлифовать, чистить, начистить, полировка, лак, лоск, глянец, политура
lovely;[ˈlʌvlɪ];прекрасный, милый, красивый, красотка
extras;[ˈekstrəz];
clause;[klɔːz];пункт, статья, предложение, оговорка, условие, клаузула
smile;[smaɪl];улыбка, благоволение, улыбаться, выражать улыбкой
troops;[ˈtruːps];войска
indoor;[ˈɪndɔːr];комнатный, домашний, находящийся в помещении, находящийся внутри дома
bulgaria;[bʌlˈɡerɪə];Болгария
armed;[ɑːrmd];вооруженный, укрепленный
broker;[ˈbrəʊkər];брокер, маклер, посредник, комиссионер
charger;[ˈtʃɑːrdʒər];заряжающий, заряжающий, строевая лошадь
regularly;[ˈreɡjələrlɪ];регулярно, правильно, аккуратно, размеренно
believed;[bəˈliːvd];
pine;[paɪn];сосна, ананас, сосновый, хвойный, тосковать, томиться
cooling;[ˈkuːlɪŋ];охлаждение, охлаждающий
tend;[tend];иметь тенденцию, ухаживать, заботиться, пасти, иметь склонность, присматривать
gulf;[ɡʌlf];пропасть, бездна, пучина, морской залив, всасывать в водоворот
rick;[rɪk];стог, скирда, растяжение, складывать в стог, растягивать
divorce;[dɪˈvɔːrs];развод, расторжение брака, разводиться, бракоразводный
shopper;[ˈʃɑːpər];
tokyo;[ˈtəʊkɪəʊ];Токио
partly;[ˈpɑːrtlɪ];частично, отчасти, частью, до некоторой степени
customize;[ˈkʌstəmaɪz];переделывать, подгонять, выполнять по индивидуальному заказу, кастомизировать
tradition;[trəˈdɪʃn];традиция, предание, привычка, обыкновение, старый обычай
candy;[ˈkændɪ];конфета, конфеты, леденец, сласти, засахаривать, засахариваться
tiger;[ˈtaɪɡər];тигр, задира, хулиган, опасный противник
donald;[];Дональд
folks;[fəʊks];близкие
sensor;[ˈsensər];датчик, чувствительный элемент, воспринимающий элемент
exposed;[ɪkˈspəʊzd];открытый, выставленный, обнаженный, незащищенный
telecom;[];
hunt;[hʌnt];охота, поиски, охотиться, преследовать, травить, гнать
deputy;[ˈdepjʊtɪ];заместитель, депутат, представитель, помощник шерифа, делегат
sealed;[ˈsiːld];запечатанный, герметичный, герметизированный, герметический, заделанный
thai;[taɪ];тайский, тайский язык, таиландец
loaded;[ˈləʊdɪd];нагруженный, заряженный, при деньгах, перегруженный, обремененный, под кайфом
fred;[];
complaint;[kəmˈpleɪnt];жалоба, недовольство, болезнь, недуг, недомогание, боль
scenes;[ˈsiːnz];
afghanistan;[æfˈɡænɪstæn];Афганистан, афганский
boost;[buːst];форсировать, повышать, ускорение, наддув, поддержка
spanking;[ˈspæŋkɪŋ];трепка, сильные шлепки, свежий, превосходный, очень, крайне, чрезвычайно
scholarship;[ˈskɑːlərʃɪp];стипендия, ученость, эрудиция
mill;[mɪl];мельница, стан, завод, мельничный, заводской, фрезеровать, молоть
founded;[ˈfaʊndəd];основанный, обоснованный
supplements;[ˈsʌpləmənts];
chronic;[ˈkrɑːnɪk];хронический, постоянный, застарелый, хроник
moral;[ˈmɔːrəl];моральный, нравственный, духовный, нравственность, мораль, нравы
den;[den];логово, притон, берлога, пещера, нора, жить в берлоге
finger;[ˈfɪŋɡər];палец, перст, штифт, указатель, стрелка, указывать, трогать пальцами
pound;[paʊnd];фунт, фунт стерлингов, загон, тюрьма, растереть, бить, биться, истолочь, толочь
locate;[ˈləʊkeɪt];находиться, размещать, обнаруживать, определять местонахождение, устанавливать
trained;[ˈtreɪnd];обученный, тренированный, дрессированный, вышколенный, выученный
burn;[bɜːrn];ожог, клеймо, выжигание растительности, сжигать, гореть, жечь, жечься, обжечь
implementing;[ˈɪmpləˌmentɪŋ];
ourselves;[ɑːrˈselvz];себя, себе, сами, собой, собой
bread;[bred];хлеб, кусок хлеба, пища, деньги, панировать, обваливать в сухарях
tobacco;[təˈbækəʊ];табак, курево, табачный
wooden;[ˈwʊdn];деревянный, безжизненный, топорный
tough;[tʌf];жесткий, трудный, жестко, грубо, хулиган, бандит, выдерживать
incident;[ˈɪnsɪdənt];инцидент, происшествие, случай, эпизод, падающий, случайный, инцидентный
dynamics;[daɪˈnæmɪks];динамика, движущие силы
lie;[laɪ];ложь, обман, положение, направление, логово, лежать, находиться, лгать, солгать
conversation;[ˌkɑːnvərˈseɪʃn];разговор, беседа, переговоры, жанровая картина
decrease;[dɪˈkriːs];уменьшение, понижение, спад, убывание, уменьшить, уменьшать, уменьшаться
chest;[tʃest];грудь, грудная клетка, сундук, ящик, ларь, грудной
pension;[ˈpenʃn];пенсия, пансионат, пансион, пособие, назначать пенсию, субсидировать
billy;[ˈbɪlɪ];походный котелок, дубинка
revenues;[ˈrevəˌnuːz];
emerging;[ɪˈmɜrdʒɪŋ];появление
worship;[ˈwɜːrʃɪp];поклоняться, почитать, боготворить, поклонение, богослужение, культ
capability;[ˌkeɪpəˈbɪlətɪ];возможности, способность, умение, одаренность
herself;[hɜːrˈself];себя, себе, сама, самой себя
producing;[prəˈduːsɪŋ];производящий
precision;[prɪˈsɪʒn];точность, четкость, аккуратность, точный, меткий
damages;[ˈdæmədʒəz];убытки
contributed;[kənˈtrɪbjuːtəd];
solve;[sɑːlv];решать, разрешать, растворять, оплатить, находить выход, объяснять
shorts;[ʃɔːrts];шорты, трусики
reproduction;[ˌriːprəˈdʌkʃn];репродукция, воспроизведение, воспроизводительный
minority;[maɪˈnɔːrətɪ];меньшинство, несовершеннолетие, меньшая часть, меньшее число
diverse;[daɪˈvɜːrs];разнообразный, разный, иной, несходный, отличный от
amp;[æmp];электрогитара
ah;[ɑː];ампер-час
sole;[səʊl];подошва, ступня, единственный, ставить подметку
franchise;[ˈfræntʃaɪz];франшиза, привилегия, право голоса, право участвовать в выборах
recorder;[rɪˈkɔːrdər];регистратор, магнитофон, регистрирующий прибор, протоколист
complaints;[kəmˈpleɪnts];
facing;[ˈfeɪsɪŋ];облицовка, отделка, обшивка, облицовочный, принимая во внимание
passion;[ˈpæʃn];страсть, увлечение, азарт, страстность, чувствовать страсть, выражать страсть
rehabilitation;[ˌrɪhəˌbɪləˈteɪʃən];реабилитация, восстановление, реконструкция, ремонт, восстановление здоровья
maintaining;[menˈteɪnɪŋ];
sight;[saɪt];вид, взгляд, зрение, зрелище, поле зрения, увидеть, заметить, наблюдать, разглядеть
laid;[leɪd];установленный, проложенный
clay;[kleɪ];глина, глинозем, ил, прах, тело, глиняный, обмазывать глиной
defence;[dɪˈfens];оборона, защита, оправдание, укрепления, оборонительные сооружения
weak;[wiːk];слабый, слабовольный, бессильный, слабоумный
refund;[ˈriːfʌnd];возврат, возвращение денег, возвращать деньги, возмещать убытки
divided;[dɪˈvaɪdəd];разделенный, отделенный, раздельный, составной, рассеченный, разъемный
blvd;[];
reception;[rɪˈsepʃn];прием, получение, восприятие, принятие, встреча, вечеринка, вечер
wise;[waɪz];мудрый, осведомленный, надоумить, способ, образ
cyprus;[ˈsaɪprəs];Кипр, Кипр, креп
odds;[ɑːdz];шансы, разногласие, перевес, разница, преимущество, неравенство, гандикап
correctly;[kəˈrektlɪ];правильно, корректно, верно, грамотно, вежливо
hearts;[ˈhɑːrts];
geography;[dʒɪˈɑːɡrəfɪ];география
integrity;[ɪnˈteɡrətɪ];целостность, неприкосновенность, честность, чистота, прямота, полнота
worry;[ˈwɜːrɪ];беспокойство, тревога, забота, волнение, беспокоить, беспокоиться, волноваться
discrimination;[dɪˌskrɪmɪˈneɪʃn];дискриминация, распознавание, проницательность, разборчивость
eve;[iːv];
carter;[ˈkɑːrtər];возчик, ломовой извозчик
legacy;[ˈleɡəsɪ];наследие, наследство
pleased;[pliːzd];довольный
danger;[ˈdeɪndʒər];опасность, угроза, гроза
vitamin;[ˈvaɪtəmɪn];витамин
widely;[ˈwaɪdlɪ];широко, далеко
processed;[ˈprɑsest];проявленный
phrase;[freɪz];фраза, выражение, оборот, язык, стиль, фразировать, выражать, выражать словами
genuine;[ˈdʒenjʊɪn];подлинный, неподдельный, настоящий, истинный, искренний, чистопородный
functionality;[ˌfʌŋkʃəˈnælətɪ];функциональность
paradise;[ˈpærədaɪs];рай, благодать, раек, галерка
hybrid;[ˈhaɪbrɪd];гибридный, смешанный, разнородный, гибрид, помесь
reads;[riːdz];
intermediate;[ˌɪntərˈmiːdɪət];промежуточный, средний, промежуточное звено, посредничать, вмешиваться
emotional;[ɪˈməʊʃənl];эмоциональный, волнующий, взволнованный
sons;[ˈsənz];
leaf;[liːf];лист, створка, листва, листовой, лиственный, перелистывать, листать
pad;[pæd];подушка, блокнот, подкладка, подушечка, дополнять, заполнять, раздувать
glory;[ˈɡlɔːrɪ];слава, великолепие, сияние, триумф, красота, прославлять, торжествовать, гордиться
bigger;[ˈbɪɡər];больший
billing;[ˈbɪlɪŋ];выручка, составление счета, реклама в афишах, выдача накладной
diesel;[ˈdiːzl];
versus;[ˈvɜːrsəs];против, в сравнении с
combine;[kəmˈbaɪn];комбинат, комбайн, объединение, синдикат, сочетать, сочетаться, совмещать
overnight;[ˌəʊvərˈnaɪt];быстро, всю ночь, ночной, оставаться на ночь
geographic;[ˌdʒɪəˈɡræfɪk];географический
exceed;[ɪkˈsiːd];превышать, превосходить, быть больше, превышать пределы, переходить границы
rod;[rɑːd];штанга, стержень, шток, тяга, жезл, прут, удочка, палочка, рычаг, рейка, брус, розга, скипетр
saudi;[ˈsaʊdɪ];саудовский, житель Саудовской Аравии
fault;[fɔːlt];неисправность, вина, ошибка, повреждение, придираться, ошибаться
cuba;[ˈkjuːbə];Куба, Куба, гаванская сигара
preliminary;[prɪˈlɪmɪnerɪ];предварительный, подготовительное мероприятие
introduce;[ɪntrəˈduːs];вводить, вносить, представлять, знакомить, применять, включать, привносить
silk;[sɪlk];шелковый, шелк, шелковая нить
promotional;[prəˈməʊʃənl];рекламный
chevrolet;[];
babies;[ˈbeɪbɪz];дети
bi;[baɪ];висмут, ампер,
compiled;[kəmˈpaɪəld];
romantic;[rəʊˈmæntɪk];романтический, романтичный, романтик
revealed;[rɪˈviːld];раскрываемый, выведенный
generator;[ˈdʒenəreɪtər];генератор, производитель, генераторный
albert;[ˈalbərt];цепочка для мужских часов
examine;[ɪɡˈzæmɪn];исследовать, рассматривать, проверять, обследовать, осматривать, допрашивать
suspension;[səˈspenʃn];подвеска, суспензия, приостановка, подвесной, висячий
bristol;[ˈbrɪstl];Бристол, Бристол, в штатах Коннектикут, бристольский
sad;[sæd];печальный, грустный, унылый, тяжелый, минор
correction;[kəˈrekʃn];коррекция, исправление, поправка, правка, наказание, выговор
wolf;[wʊlf];волк, хищник, бабник, жадный человек, пожирать с жадностью
slowly;[ˈsləʊlɪ];медленно
authentication;[ɔːˌθentɪˈkeɪʃn];
communicate;[kəˈmjuːnɪkeɪt];сообщить, сообщать, сообщаться, передавать, сноситься, снестись, причащать
rugby;[ˈrʌɡbɪ];регби
supplement;[ˈsʌplɪmənt];дополнение, приложение, добавление, дополнять, пополнять, добавлять
cal;[];
infant;[ˈɪnfənt];детский, зарождающийся, начальный, младенец, ребенок, дитя
promoting;[prəˈməʊtɪŋ];
fluid;[ˈfluːɪd];жидкость, жидкая среда, текучий, жидкий, подвижный, изменчивый
kick;[kɪk];удар, пинок, толчок, удовольствие, пинать, выгонять, брыкать, брыкаться
regards;[rɪˈɡɑːrdz];привет, поклон
meal;[miːl];еда, принятие пищи, мука, обваливать в муке, перемалывать
hurt;[hɜːrt];боль, вред, ущерб, повредить, болеть, обижать, пострадавший
machinery;[məˈʃiːnərɪ];машины, механизм, машинное оборудование, аппарат, детали машин, структура
bandwidth;[ˈbændwɪdθ];ширина полосы, полоса пропускания, пропускная способность, иногда скорость в…
unlike;[ˌʌnˈlaɪk];в отличие от, непохожий на, разноименный
equation;[ɪˈkweɪʒn];уравнение, выравнивание
probability;[ˌprɑːbəˈbɪlətɪ];вероятность, правдоподобие
pot;[pɑːt];горшок, банка, кастрюля, котел, чайник, сажать ребенка на горшок
dimension;[daɪˈmenʃn];размер, измерение, размерность, величина, проставлять размеры
proven;[ˈpruːvən];доказанный
cached;[kæʃt];
warren;[ˈwɔːrən];кроличий садок, перенаселенный дом или район, участок, где водятся кролики
slip;[slɪp];скольжение, проскальзывание, промах, проскользнуть, скользить, выскользнуть
studied;[ˈstʌdɪd];изучаемый, обдуманный, знающий, преднамеренный, деланный, начитанный
reviewer;[rɪˈvjuːər];рецензент, обозреватель
quarterly;[ˈkwɔːrtərlɪ];ежеквартальный, раз в квартал, ежеквартальник
rpm;[];
profits;[ˈprɑːfəts];
devil;[ˈdevl];дьявол, черт, бес, сатана, человек, парень, надоедать, дразнить
grass;[ɡræs];трава, травка, газон, злак, луг, засевать травой, пастись, подножный
comply;[kəmˈplaɪ];подчиняться, исполнять, соглашаться, уступать, исполнять просьбу
florist;[ˈflɔːrɪst];флорист, цветовод, торговец цветами, цветочник
cherry;[ˈtʃerɪ];вишня, черешня, вишневое дерево, вишневый, черешневый, вишневого цвета
continental;[ˌkɑːntɪˈnentl];континентальный, материковый, неангличанин, иностранец
alternate;[ˈɔːltərneɪt];чередоваться, чередовать, заместитель, дублер, чередующийся
achievement;[əˈtʃiːvmənt];достижение, успех, выполнение, подвиг
kenya;[ˈkenjə];Кения
cuts;[ˈkəts];
funeral;[ˈfjuːnərəl];похоронный, похороны, похоронная процессия
enjoyed;[ɪnˈdʒɔɪd];
automated;[ˈɒtəˌmetəd];автоматизировать
quebec;[kwɪˈbek];Квебек, Квебек, город и порт в Канаде, квебекский
passenger;[ˈpæsɪndʒər];пассажир, седок, слабый игрок спортивной команды, неспособный член
convenient;[kənˈviːnɪənt];удобный, подходящий, пригодный
mars;[mɑːrz];Марс
sized;[ˈsaɪzd];то размера, устанавливать размеры
noticed;[ˈnəʊtɪst];замеченный
socket;[ˈsɑːkɪt];гнездо, розетка, муфта, патрон, патрубок, раструб, втулка, углубление, впадина
silent;[ˈsaɪlənt];тихий, молчаливый, немой, безмолвный, немой фильм
literary;[ˈlɪtərerɪ];литературный, книжный, литературно образованный
egg;[eɡ];яйцо, яйцеклетка, зародыш, яичный, науськивать, подстрекать
mhz;[];
caps;[kæps];
orientation;[ˌɔːrɪənˈteɪʃn];ориентация, ориентирование, ориентировка
pill;[pɪl];таблетка, пилюля, шарик, грабить, давать пилюли, забаллотировать
theft;[θeft];
childhood;[ˈtʃaɪldhʊd];детство, детский возраст, младенчество
swing;[swɪŋ];качели, свинг, поворот, качание, колебание, качаться, качать, размахивать
meta;[ˈmetə];
humans;[ˈhjuːmənz];
analog;[ˈænəlɔːɡ];аналог, моделирующее устройство, моделирующая система
facial;[ˈfeɪʃl];лицевой, массаж лица
talent;[ˈtælənt];талант, талантливость, дар, одаренность, способность, талантливый человек
dated;[ˈdeɪtɪd];датированный, устаревший, вышедший из употребления
flexibility;[ˌfleksəˈbɪlətɪ];гибкость, уступчивость
seeker;[ˈsɪkər];самонаводящийся снаряд
wisdom;[ˈwɪzdəm];мудрость, премудрость, здравый смысл
shoot;[ʃuːt];стрелять, снять, застрелить, расстрелять, побег, охота, стрельба, бросок, росток, рывок
boundary;[ˈbaʊndrɪ];граница, черта, межа, пограничный
mint;[mɪnt];мята, монетный двор, мятный, новый, чеканить, создавать
packard;[];
offset;[ˈɔːfset];смещенный, офсетный, смещение, компенсация, компенсировать, возмещать
payday;[ˈpeɪdeɪ];день выплаты жалованья, получка, день платежа
philip;[ˈfɪlɪp];Филип, Филипп
elite;[eɪˈliːt];элита, цвет, отборная часть, элитный
spin;[spɪn];спин, вращение, штопор, кружение, верчение, крутиться, крутить, прясть, вертеться
swedish;[ˈswiːdɪʃ];шведский, шведский язык
deadline;[ˈdedlaɪn];предельный срок, предел, ремонт, сдать в ремонт
jurisdiction;[ˌdʒʊrɪsˈdɪkʃn];юрисдикция, подсудность, правосудие, подведомственность, сфера полномочий
robot;[ˈrəʊbɑːt];робот, автомат, автоматический
displaying;[ˌdɪˈspleɪɪŋ];
witness;[ˈwɪtnəs];свидетель, свидетельство, очевидец, свидетельствовать, видеть
collins;[ˈkɒlɪnz];
equipped;[ɪˈkwɪpt];оборудованный, оснащенный
stages;[ˈsteɪdʒəz];
powder;[ˈpaʊdər];порошок, пудра, порох, пыль, присыпка, пудриться, напудрить, припудривать
acquired;[əˈkwaɪərd];приобретенный, благоприобретенный, нажитый
assess;[əˈses];оценивать, облагаться, облагать налогом, штрафовать, определять сумму налога
wash;[wɑːʃ];мытье, стирка, промывка, мыть, мыться, вымыться, стирающийся, нелиняющий
entrance;[ˈentrəns];вход, въезд, выход, доступ, входной, вступительный, заворожить, восторгать
gnome;[nəʊm];гном, карлик, афоризм, сентенция, поговорка, международный банкир
declaration;[ˌdekləˈreɪʃn];декларация, заявление, объявление, описание, таможенная декларация
