eng;transcription;rus
the;[ðiː];тот, такой, этот, тем
and;[ænd];и, а, но, иначе, конъюнкция
in;[ɪn];в, на, по, во, при, с, у, из, внутри, внутрь, связи, влияние
for;[fɔːr];для, на, за, в, к, в течение, от, ради, из-за, вместо, ибо, ввиду того, что
is;[ɪz];быть, находиться, составлять, происходить, существовать, равняться, стоить, бывать
on;[ɑːn];на, по, о, в, об, согласно, левая сторона
that;[ðæt];что, чтобы, который, то, тот, та, так, до такой степени
by;[baɪ];по, на, к, при, у, мимо, согласно, около, рядом с, мимо, согласно, рядом, около, близко
this;[ðɪs];эта, это, этот, сей
with;[wɪð];с, вместе с, от, несмотря на, напихать
i;[aɪ];
you;[juː];вы, вам, вами, вас, ты, тебя, тебе, тобой
it;[ɪt];это, этого, он, она, оно, него, последнее слово, идеал
not;[nɑːt];не, нет, ни
or;[ɔːr];или, либо, дизъюнкция, желтый цвет, золотой цвет
be;[biː];быть, находиться, должен, тратта
are;[ɑːr];быть, находиться, составлять, происходить, существовать, равняться, стоить, бывать
from;[frʌm];от, из, с, судя по
at;[æt];в, на, при, у, за, около, собака, атомный, герметический
as;[æz];как, согласно, как, так как, когда, какой, что, который, в качестве, в виде
your;[jʊr];ваш, твой
all;[ɔːl];все, весь, целый, все, целое, все, весь, вся, совершенно, всецело
have;[hæv];иметь, обладать, получать, содержать, обман, мошенничество
new;[nuː];новейший, новый, недавний, новое, недавно, заново, только что
more;[mɔːr];более, больше, еще, гораздо, больший, дополнительный, большее количество
was;[wʌz];быть, находиться, составлять, происходить, существовать, равняться, стоить, бывать
we;[wiː];мы, нами
will;[wɪl];воля, желание, завещание, волеизъявление, хотеть, желать, завещать, проявлять волю
home;[həʊm / hoʊm];дома, домой, в цель, дом, жилище, родина, домашний, родной, жить
can;[kæn];может, жестяная банка, баллончик, мочь, иметь возможность
us;[ʌs];нам, нами, нас
about;[əˈbaʊt];о, об, около, по, около, меняющий курс, менять курс
if;[ɪf];если, ли, если бы, хотя, коли, условие, предположение, во всяком случае
page;[peɪdʒ];страница, полоса, паж, яркое событие, нумеровать страницы
my;[maɪ];мой, моя, мое, мои, свой, свое, принадлежащий мне
has;[hæz];иметь, обладать, получать, содержать, испытывать, проводить, знать, родить, говорить
search;[sɜːrtʃ];поиски, поиск, обыск, розыск, искать, поискать, поисковый
free;[friː];бесплатный, бесплатно, свободно, освобождать, выходной
but;[bʌt];но, а, однако, зато, кроме, только, кроме, возражение, кто бы не
our;[ˈaʊər];наш, наша, наше, наши, свое
one;[wʌn];один, номер один, один, кто-то, единственный, единица, одиночка
other;[ˈʌðər];другой, остальные, иной, другой, иначе
do;[duː];делать, выполнять, до, развлечение, то же самое, таким же образом
no;[nəʊ];нет, не, никакой, нисколько не, отказ, отрицание
information;[ˌɪnfərˈmeɪʃn];информация, данные, справки, сообщение, знания, осведомленность, донесение, жалоба
time;[taɪm];время, времена, раз, период, приурочить, повременный
they;[ðeɪ];они
site;[saɪt];место, участок, местоположение, располагать, выбирать место
he;[hiː];он, него, мужчина, водящий, взрывчатое вещество
up;[ʌp];вверх, вверху, по, вверх по, поднимать, подъем, успех, повышающийся
may;[meɪ];
what;[wʌt];что, что, как, каков, какой, какой, сколько
which;[wɪtʃ];который, который, какой, что, кто, каковой
their;[ðer];их, свой, свое, свои
news;[nuːz];
use;[juːz];использование, применение, пользование, использовать, пользоваться, применять
any;[ˈenɪ];любой, никакой, какой-либо, никакой, какой-нибудь, сколько-нибудь, вообще
there;[ðer];там, туда, здесь, тут, вон, на этом месте, в этом отношении
see;[siː];престол, епархия, видать, увидеть, видеть, видеться
only;[ˈəʊnlɪ];только, лишь, всего, только, но, единственный
so;[səʊ];так, таким образом, поэтому, поэтому, чтобы, так что
his;[hɪz];его, свое, свой, принадлежащий ему, принадлежащий ему
when;[wen];когда, хотя, когда, если, как только, время, дата
contact;[ˈkɑːntækt];контакт, связь, связи, связывающий, контактный, связаться, соприкасаться
here;[hɪr];здесь, сюда, вот, тут, вон, в этот момент, настоящее место
business;[ˈbɪznəs];бизнес, дело, фирма, занятие, деловой, практический
who;[huː];кто, который, те, кто, тот, кто
web;[web];сеть, паутина, ткань, стержень, перемычка, заманивать в сеть, заманивать в сети
also;[ˈɔːlsəʊ];также, тоже, к тому же
now;[naʊ];сейчас, теперь, настоящее время, раз, когда
help;[help];помощь, помощник, подсказка, подмога, помогать, способствовать
get;[ɡet];получать, попасть, добираться, потомство, приплод, идиот, дурак
pm;[ˌpiː ˈem];министр, начальник военной полиции, фазовая модуляция
view;[vjuː];вид, взгляд, мнение, осмотр, поле зрения, смотреть, рассматривать, осматривать
first;[fɜːrst];первый, ранний, первый, сначала, впервые, начало
am;[æm];быть, находиться, составлять, происходить, существовать, равняться, стоить, бывать
been;[bɪn];быть, находиться, составлять, происходить, существовать, равняться, стоить, бывать
would;[wʊd];
how;[haʊ];как, каким образом, сколько, что, способ, метод
were;[wɜːr];быть, находиться, составлять, происходить, существовать, равняться, стоить, бывать
me;[miː];меня, мне, мной, себя, патологоанатом
services;[ˈsɜːvəsəz];
some;[sʌm];некоторые, одни, другие, некоторый, какой-то, несколько, немного, около
these;[ðiːz];эти
click;[klɪk];щелчок, защелка, щелканье, щелкающий звук, щелкать, ладить, иметь успех
like;[laɪk];любить, подобный, подобно, так, как бы, как будто, очень
service;[ˈsɜːrvɪs];обслуживание, служба, обслуживать, случать, служебный
than;[ðæn];чем, кроме, как, чтобы
find;[faɪnd];находить, считать, обрести, изыскать, находка, открытие
price;[praɪs];цена, ценность, расценка, жертва, оценивать, назначать цену
date;[deɪt];дата, срок, время, свидание, период, финик, датировать, устареть
back;[bæk];назад, обратно, обратный, задний, спина, защитник, отступать
top;[tɑːp];верхний, высший, вершина, верх, первое место, превышать, покрывать
people;[ˈpiːpl];люди, народ, население, жители, нация, населять, заселять, расти
had;[hæd];иметь, обладать, получать, содержать, испытывать, проводить, знать, родить, говорить
list;[lɪst];список, перечень, реестр, перечислять, крениться, сделанный из каймы
name;[neɪm];назвать, называть, указывать, назначать, имя, название, наименование, фамилия
just;[dʒʌst];просто, только что, как раз, именно, точно, точный, справедливый, верный, заслуженный
over;[ˈəʊvər];больше, за, над, на, по, чрезмерный, чрезмерно, свыше, излишек, перелет
state;[steɪt];государственный, состояние, государство, констатировать
year;[jɪr];год, годы, возраст
day;[deɪ];день, сутки, время, рабочий день, дневной
into;[ˈɪntuː];в, на, к
two;[tuː];два, двое, двое, пара, двойка
health;[helθ];здоровье, самочувствие, здравие, санитарный, гигиенический
world;[wɜːrld];мир, свет, вселенная, общество, царство, мировой, всемирный
re;[reɪ];ре, относительно, касательно, ссылаясь на
next;[nekst];следующий, ближайший, рядом, дальше, затем, около, рядом, около
used;[juːst];использованный, используемый, подержанный, отработавший, отработанный
go;[ɡəʊ];идти, ехать, ходить, переходить, ездить, ход, движение, попытка, ходьба
work;[wɜːrk];работа, труд, произведение, дело, дела, работать, трудиться, действовать
last;[læst];последний, прошлый, длиться, продлиться, в последний раз, конец, колодка, ласт
most;[məʊst];большинство, наиболее, самый, многие, наибольший
music;[ˈmjuːzɪk];музыка, ноты, музыкальное произведение, оркестр, хор
buy;[baɪ];купить, покупать, приобретать, накупить, покупка
data;[ˈdeɪtə , ˈdætə];данные, информация, сведения, факты
make;[meɪk];марка, изготовление, производство, модель, делаться, делать, производить, совершать
them;[ðem];их, им
should;[ʃʊd];должен
product;[ˈprɑːdʌkt];продукт, продукция, изделие, произведение, результат, продукт реакции, плоды
system;[ˈsɪstəm];система, устройство, сеть, организм, метод, способ, формация, вычислительная система
post;[pəʊst];пост, должность, после, почтой, вывешивать, почтовый
her;[hɜːr];ее, ей, свой, принадлежащий ей
city;[ˈsɪtɪ];город, большой город, старинный город, городской, муниципальный, общегородской
add;[æd];добавлять, сложить, прибавлять, придать, складывать, увеличивать, присоединять
policy;[ˈpɑːləsɪ];политика, полис, курс, страховой полис, линия поведения, установка, хитрость
number;[ˈnʌmbər];число, номер, количество, цифра, сумма, числиться, нумеровать, насчитывать
such;[sʌtʃ];такой, таковой, такой-то, определенный, такой, такие, таковой, те, тот
please;[pliːz];радовать, нравиться, угождать, доставлять удовольствие, соблаговолить, изволить
available;[əˈveɪləbl];доступный, имеющийся, налицо, имеющийся в наличии, наличный
copyright;[ˈkɑːpɪraɪt];авторское право
support;[səˈpɔːrt];поддержка, помощь, опора, суппорт, поддерживать, содействовать
message;[ˈmesɪdʒ];сообщение, послание, письмо, идея, сигнализировать, телеграфировать
after;[ˈæftər];после, спустя, вслед, после, через, за, по, после того как, последующий, задний
best;[best];лучший, больший, лучше всего, больше всего, провести, перехитрить
software;[ˈsɔːftwer];программное обеспечение, программные системы, программы для компьютера
then;[ðen];тогда, затем, потом, тогдашний, впрочем
good;[ɡʊd];хороший, добрый, благой, хорошо, добро, благо, польза
video;[ˈvɪdɪəʊ];видео, изображение, видеомагнитофон, телевизионный
well;[wel];ну, что ж, уж, хороший, хорошо, вполне, колодец, бить ключом
where;[wer];где, куда, где, туда, туда где, место происшествия
info;[ˈɪnfəʊ];информация, сообщения, осведомленность, жалоба, обвинение, знания, сведения
public;[ˈpʌblɪk];общественный, государственный, общественность, публика, народ, трактир
high;[haɪ];высокий, большой, сильный, высоко, сильно, интенсивно, максимум, высшая точка
school;[skuːl];школа, обучение, класс, школить, обучать, приучать, школьный, учебный
through;[θruː];через, посредством, сквозной, прямой, благодаря, насквозь, пролезать
each;[iːtʃ];каждый, всякий, каждый, любой
she;[ʃiː];она, та, которая, женщина, самка
review;[rɪˈvjuː];обзор, рассмотрение, пересмотр, просмотр, пересмотреть, рассматривать
years;[jiə(r)z];возраст
order;[ˈɔːrdər];заказ, порядок, приказ, распоряжение, ордер, заказывать, приказывать, упорядочивать
very;[ˈverɪ];очень, даже, самый, тот самый, истинный, сам по себе
privacy;[ˈpraɪvəsɪ];частная жизнь, уединение, уединенность, секретность, тайна
book;[bʊk];книга, книжка, журнал, том, заказывать, книжный
company;[ˈkʌmpənɪ];компания, фирма, общество, рота, труппа, фирменный, ротный
read;[riːd];читать, прочесть, считывать, чтение, чтиво, начитанный, образованный
group;[ɡruːp];группа, группировка, группировать, групповой
sex;[seks];
need;[niːd];необходимость, потребность, нужда, нуждаться, требоваться
many;[ˈmenɪ];многие, многочисленные, много, множество, большинство
user;[ˈjuːzər];пользователь, потребитель, наркоман, пользование правом или вещью
said;[sed];указанный, упомянутый, вышеуказанный, вышеупомянутый
does;[dʌz];, делать, сделать
set;[set];набор, комплект, сет, установившийся, устанавливать, заходить
under;[ˈʌndər];меньше, под, при, по, вниз, внизу, ниже, меньший, нижний, недолет
general;[ˈdʒenrəl];общий, генеральный, обычный, генерал, полководец
research;[rɪˈsɜːrtʃ];исследование, исследовательский, исследовать
university;[ˌjuːnɪˈvɜːrsətɪ];университет, университетский
january;[ˈdʒænjʊerɪ];январь, январский
mail;[meɪl];почта, кольчуга, почтовый, посылать по почте
full;[fʊl];полный, целый, наполненный, вполне, очень, как раз, валять, кроить широко
map;[mæp];карта, план, таблица, лицо, личность, картографировать, чертить карту
program;[ˈprəʊɡræm];программа, план, спектакль, программировать, программный
life;[laɪf];жизнь, срок службы, образ жизни, пожизненный, длящийся всю жизнь
know;[nəʊ];знать, узнавать, уметь, иметь представление, испытывать, пережить, быть знакомым
way;[weɪ];путь, способ, сторона, дорога, метод, далеко, значительно, чересчур
days;[ˈdeɪz];днем, эпоха
management;[ˈmænɪdʒmənt];управление, менеджмент, администрация, дирекция, правление, умение справляться
part;[pɑːrt];частью, частично, отчасти, часть, сторона, роль, деталь, разнимать, расставаться
could;[kʊd];
great;[ɡreɪt];большой, отличный, великий, замечательно, вельможи
united;[jʊˈnaɪtɪd];объединенный, соединенный, дружный, совместный
hotel;[həʊˈtel];отель, гостиница
real;[ˈriːəl];реальный, настоящий, действительность, действительно, очень
item;[ˈaɪtəm];пункт, вопрос, статья, номер, равным образом, также, тоже, записывать по пунктам
international;[ˌɪntərˈnæʃnəl];международный, интернациональный, международное состязание
center;[ˈsentər];центр, середина, средоточие, ось, стержень, центрировать, концентрировать
must;[mʌst];должен, нужно, надо, обязан, необходимость, муст, быть должным
store;[stɔːr];магазин, склад, универмаг, хранить, накапливать, запасной, запасный, готовый
travel;[ˈtrævl];путешествие, движение, ход, путешествовать, ехать, дорожный
made;[meɪd];сделанный, изготовленный, сборный, приготовленный, готовый, искусственный
development;[dɪˈveləpmənt];развитие, разработка, создание, строительство, рост, совершенствование, событие
report;[rɪˈpɔːrt];отчет, доклад, сообщение, сообщить, сообщать, отчетный
member;[ˈmembər];член, участник, представитель, деталь, звено, часть, партнер, элемент конструкции
line;[laɪn];линь, линия, строка, ряд, линейный, проводить линию, набивать
terms;[ˈtɜːmz];
before;[bɪˈfɔːr];перед, до, выше, впереди, до, прежде чем, прежде чем, раньше, выше
did;[dɪd];делать, выполнять, заниматься, поступать, проделать, действовать, исполнять
send;[send];отправлять, послать, посылать, передавать, присылать, отсылать, рассылать, слать
right;[raɪt];правый, прямой, право, правильность, прямо, правильно, исправлять
type;[taɪp];тип, модель, разновидность, типаж, род, шрифт, печатать, напечатать, отпечатать
because;[bɪˈkɔːz];потому что, так как, ибо
local;[ˈləʊkl];местный, локальный, частный, низовой, местный житель, местная организация
those;[ðəʊz];те, тех, теми
office;[ˈɔːfɪs];офис, служба, должность, бюро, управление, пост, контора, ведомство, канцелярия
education;[ˌedʒʊˈkeɪʃn];образование, образованность, обучение, воспитание, просвещение, культура, развитие
national;[ˈnæʃnəl];национальный, государственный, народный, гражданин, соотечественник, согражданин
car;[kɑːr];автомобиль, машина, вагон, легковой автомобиль, автомашина, тачка, тележка
design;[dɪˈzaɪn];дизайн, разработка, конструкция, проектировать, разрабатывать
take;[teɪk];взятие, дубль, захват, сбор, выручка, улов, принимать, брать, считать, занимать
posted;[ˈpəʊstɪd];
internet;[ˈɪntərnet];интернет
address;[əˈdres];адрес, обращение, адресовать, обращаться, адресный
community;[kəˈmjuːnətɪ];сообщество, община, общество, общность, общественный
within;[wɪˈðɪn];в, в течение, в пределах, в пределах, внутри, внутренняя сторона
states;[ˈsteɪts];
area;[ˈerɪə];площадь, область, район, зона, сфера, участок, пространство, поверхность, ареал, край
want;[wɑːnt];нужда, желание, необходимость, желать, хотеть, хотеться, нуждаться
phone;[fəʊn];телефон, фона, звонить по телефону
shipping;[ˈʃɪpɪŋ];перевозка груза, судоходство, перевозка, погрузка, торговые суда, торговый флот
reserved;[rɪˈzɜːrvd];зарезервированный, сдержанный, резервный, замкнутый, заказанный заранее
subject;[ˈsʌbdʒekt];подвергать, подчинять, тема, предмет, субъект, подлежащий, подчиненный
between;[bɪˈtwiːn];между, между
forum;[ˈfɔːrəm];форум, суд, собрание, свободная дискуссия, зал для совещаний
family;[ˈfæməlɪ];семья, семейство, род, содружество, семейный, фамильный, родовой
long;[lɔːŋ];длинный, долгий, долго, давно, долгий срок, стремиться
based;[ˈbeɪst];
code;[kəʊd];код, кодекс, кодировка, законы, кодировать, шифровать, кодифицировать
show;[ʃəʊ];шоу, выставка, показ, показывать, проявлять, выставочный
even;[ˈiːvn];даже, ровно, точно, выровнять, четный, ровный, вечер, склон дня
